{
  "$schema": "./extension-fields.schema.json",
  "version": "1.3.0",
  "updated": "2026-10-24",
  "registration_process": "https://github.com/jagmarques/asqav-registry/blob/main/REGISTRATION.md",
  "note": "Administered by Asqav, not IANA. RFC 8726 bars an Independent Submission from creating an IANA registry, so the defining document keeps these as normative tables and points here for administration. Transfer to IANA under Specification Required is expected if the document is progressed on the IETF Stream.",
  "registry": "Compliance Receipt Extension Fields",
  "entries": [
    {
      "field_name": "risk_class",
      "scope": "signed-payload",
      "description": "Risk classification term under the Deployer's risk management documentation; defined in [extension-fields]",
      "reference": "draft-marques-asqav-compliance-receipts",
      "vocabulary": "Vocabulary referenced in Audit Pack metadata",
      "change_controller": "Asqav"
    },
    {
      "field_name": "incident_class",
      "scope": "signed-payload",
      "description": "Incident classification term spanning DORA Article 18(1) (with further specification in [REG-2024-1772] and the canonical reporting enumeration of Annex II field 3.23 of [REG-2025-302]), 23 NYCRR 500.1 Cybersecurity Event/Incident, [CIRCIA] Covered Cyber Incident, and HIPAA security incident under 45 CFR 164.304; defined in [extension-fields]",
      "reference": "draft-marques-asqav-compliance-receipts",
      "vocabulary": "Audit Pack metadata",
      "change_controller": "Asqav"
    },
    {
      "field_name": "counterparty_binding",
      "scope": "signed-payload",
      "description": "Signed-payload object carrying a base64-encoded SHA-256 digest (envelope_hash) of a peer agent's full signed envelope including signature bytes, a resolvable opaque locator (receipt_ref), an optional expected-acknowledger identifier (expect_ack_from), and an optional operational transport_label; see [counterparty-binding] for the full member set and the digest-scope rule",
      "reference": "draft-marques-asqav-compliance-receipts",
      "vocabulary": "Member vocabulary defined in [counterparty-binding-wire]; digest algorithm is SHA-256 per [ACTA-RECEIPTS] with base64 encoding per [RFC4648]",
      "change_controller": "Asqav"
    },
    {
      "field_name": "result_digest",
      "scope": "signed-payload",
      "description": "Object of the upstream payload_digest shape (hash, size, optional preview) carrying a SHA-256 digest of the downstream Action's result body; defined in [result-bound]",
      "reference": "draft-marques-asqav-compliance-receipts",
      "vocabulary": "Digest algorithm is SHA-256 with hex encoding under the sha256:&lt;64 hex&gt; form",
      "change_controller": "Asqav"
    },
    {
      "field_name": "expires_at",
      "scope": "signed-payload",
      "description": "ISO 8601 timestamp with explicit timezone declaring the wall-clock time after which the producing system considers the decision result stale and not safe to replay; declared, not enforced, against the receipt itself (the receipt record never expires); defined in [result-bound]",
      "reference": "draft-marques-asqav-compliance-receipts",
      "vocabulary": "Free-form ISO 8601 string",
      "change_controller": "Asqav"
    },
    {
      "field_name": "nonce",
      "scope": "signed-payload",
      "description": "Producer-generated string unique across the producer's emission stream for the lifetime of kid; defined in [result-bound]",
      "reference": "draft-marques-asqav-compliance-receipts",
      "vocabulary": "Any unique string; the lowercase hexadecimal encoding of 12 random bytes (24 hexadecimal characters) is the recommended form",
      "change_controller": "Asqav"
    },
    {
      "field_name": "hash_algo",
      "scope": "signed-payload",
      "description": "Member of the payload recording how the receipt's context digest was produced; sha256 denotes an unkeyed SHA-256 digest and hmac-sha256 an HMAC-SHA256 keyed digest under a holder salt; the digest string keeps the sha256:&lt;64 hex&gt; wire form in both cases; defined in [verdict-vocabulary]",
      "reference": "draft-marques-asqav-compliance-receipts",
      "vocabulary": "Value vocabulary {sha256, hmac-sha256} per [verdict-vocabulary]",
      "change_controller": "Asqav"
    },
    {
      "field_name": "tool_fingerprint",
      "scope": "signed-payload",
      "description": "JSON string of 32 lowercase hex characters carrying the truncated (first 128 bits) SHA-256 digest of the JCS-canonical ([RFC8785]) serialization of the JSON object {\"tool_name\": &lt;tool name&gt;, \"schema\": &lt;declared input schema&gt;}; defined in [result-bound]",
      "reference": "draft-marques-asqav-compliance-receipts",
      "vocabulary": "Digest algorithm is SHA-256 over [RFC8785] canonical bytes, truncated to its first 32 hexadecimal characters",
      "change_controller": "Asqav"
    },
    {
      "field_name": "config_manifest_digest",
      "scope": "signed-payload",
      "description": "JSON string formatted sha256:&lt;64 hex&gt; over the canonical bytes of the producer's configuration manifest in effect at signing time; defined in [result-bound]",
      "reference": "draft-marques-asqav-compliance-receipts",
      "vocabulary": "Manifest content is operator-defined; canonicalization rule is operator-declared in the Audit Pack manifest entry",
      "change_controller": "Asqav"
    },
    {
      "field_name": "cve_inventory_digest",
      "scope": "signed-payload",
      "description": "JSON string formatted sha256:&lt;64 hex&gt; over the canonical bytes of the producer's CVE inventory at signing time; defined in [result-bound]",
      "reference": "draft-marques-asqav-compliance-receipts",
      "vocabulary": "Inventory content lists CVE identifiers per the producer's accepted-residual rationale",
      "change_controller": "Asqav"
    },
    {
      "field_name": "executable_hash",
      "scope": "signed-payload",
      "description": "JSON string formatted sha256:&lt;64 hex&gt; over the canonical bytes of the executable that invoked the Action (OCI image manifest digest for container producers, on-disk SHA-256 for non-container executables); defined in [build-provenance]",
      "reference": "draft-marques-asqav-compliance-receipts",
      "vocabulary": "Digest algorithm is SHA-256",
      "change_controller": "Asqav"
    },
    {
      "field_name": "sbom_digest",
      "scope": "signed-payload",
      "description": "JSON string formatted sha256:&lt;64 hex&gt; over the canonical bytes of the CycloneDX or SPDX SBOM document covering the executing image; defined in [build-provenance]",
      "reference": "draft-marques-asqav-compliance-receipts",
      "vocabulary": "SBOM format and version declared in the Audit Pack manifest entry",
      "change_controller": "Asqav"
    },
    {
      "field_name": "slsa_provenance_pointer",
      "scope": "signed-payload",
      "description": "JSON string carrying an https URL resolving to the SLSA provenance attestation envelope for the build of the executable identified by executable_hash; defined in [build-provenance]",
      "reference": "draft-marques-asqav-compliance-receipts",
      "vocabulary": "Target should be the SLSA Provenance v1.0 in-toto statement form",
      "change_controller": "Asqav"
    },
    {
      "field_name": "supply_chain_pointer",
      "scope": "signed-payload",
      "description": "JSON string carrying an https URL resolving to a transparency-log entry (in-toto, Sigstore, or Rekor) covering the build of the executable identified by executable_hash; defined in [build-provenance]",
      "reference": "draft-marques-asqav-compliance-receipts",
      "vocabulary": "Verifier acceptance is recommended across the three log formats",
      "change_controller": "Asqav"
    },
    {
      "field_name": "anchors",
      "scope": "envelope-level",
      "description": "Envelope-level array of timestamping anchors covering the signed envelope; entries carry a required type discriminator (rfc3161 or opentimestamps; transparency-log pointers are not anchor types) and a required value field, plus optional informational members status (anchored / pending / failed) and anchor_block_hash (string Bitcoin block hash for upgraded OpenTimestamps entries); full schema is defined in [anchoring]",
      "reference": "draft-marques-asqav-compliance-receipts",
      "vocabulary": "Anchor type vocabulary: rfc3161 per [RFC3161], opentimestamps per [OPENTIMESTAMPS]",
      "change_controller": "Asqav"
    },
    {
      "field_name": "witness_policy",
      "scope": "signing-time declaration",
      "scope_note": "not a wire member",
      "description": "Declaration the producer gives the issuing platform with the signing request, declaring an N-of-M durable-anchoring quorum over the receipt's anchors array; carries a required integer required in the closed range [1, length of witnesses] and a required non-empty array witnesses whose distinct values are a subset of {rfc3161, opentimestamps} (Rekor and other transparency-log pointers are not witness types and are rejected). The receipt reaches the quorum-met state only when at least required distinct witness types each hold a verifiable inclusion proof; a producer must not assert durable anchoring unless that holds, per the false-attestation rule of [anchoring]; defined in [anchoring]",
      "reference": "draft-marques-asqav-compliance-receipts",
      "vocabulary": "Witness type vocabulary: rfc3161 per [RFC3161], opentimestamps per [OPENTIMESTAMPS]; inclusion-proof prior art per [RFC9943] and [RFC9162]",
      "change_controller": "Asqav"
    },
    {
      "field_name": "mitre_techniques",
      "scope": "signed-payload",